<?xml version="1.0" encoding="UTF-8"?>
<!DOCTYPE graph-query SYSTEM "graph-query.dtd">

<!-- Part of the open-source Proximity system (see LICENSE for 
     copyright and license information). -->

<graph-query name="Const_DB02_Q02">
  <description>Genealogy query with inequality constraint</description>
  <query-body>
    <vertex name="child">
      <condition>
        <test>
          <operator>eq</operator>
          <attribute-name>ObjType</attribute-name>
          <value>person</value>
        </test>
      </condition>
    </vertex>
    <vertex name="parent1">
      <condition>
        <test>
          <operator>eq</operator>
          <attribute-name>ObjType</attribute-name>
          <value>person</value>
        </test>
      </condition>
    </vertex>
    <vertex name="parent2">
      <condition>
        <test>
          <operator>eq</operator>
          <attribute-name>ObjType</attribute-name>
          <value>person</value>
        </test>
      </condition>
    </vertex>
    <edge name="has-parent1">
      <vertex1>child</vertex1>
      <vertex2>parent1</vertex2>
      <directed>true</directed>
      <condition>
        <test>
          <operator>eq</operator>
          <attribute-name>LinkType</attribute-name>
          <value>has-parent</value>
        </test>
      </condition>
    </edge>
    <edge name="has-parent2">
      <vertex1>child</vertex1>
      <vertex2>parent2</vertex2>
      <directed>true</directed>
      <condition>
        <test>
          <operator>eq</operator>
          <attribute-name>LinkType</attribute-name>
          <value>has-parent</value>
        </test>
      </condition>
    </edge>
    <constraint>
      <and>
        <test>
          <operator>ne</operator>
          <item>
            <item-name>parent1</item-name>
            <id />
          </item>
          <item>
            <item-name>parent2</item-name>
            <id />
          </item>
        </test>
      </and>
    </constraint>
  </query-body>
  <editor-data>
    <vertex-location name="child" x="217.0" y="227.0" />
    <vertex-location name="parent1" x="45.0" y="97.0" />
    <vertex-location name="parent2" x="439.0" y="105.0" />
  </editor-data>
</graph-query>

