<?xml version="1.0" encoding="UTF-8"?>
<!DOCTYPE graph-query SYSTEM "graph-query.dtd">

<graph-query name="new query">
    <description>no description</description>
    <query-body>
        <vertex name="Item1">
            <condition>
                <test>
                    <operator>eq</operator>
                    <attribute-name>obj_type</attribute-name>
                    <value>Individual</value>
                </test>
            </condition>
        </vertex>
    </query-body>
</graph-query>

