<?xml version="1.0" encoding="UTF-8"?>
<!DOCTYPE graph-query SYSTEM "graph-query.dtd">

<!-- Part of the open-source Proximity system (see LICENSE for 
     copyright and license information). -->

<graph-query name="Cond_DB03_Q01">
  <description>Condition testing missing values</description>
  <query-body>
    <vertex name="book">
      <condition>
        <test>
          <operator>eq</operator>
          <attribute-name>ObjType</attribute-name>
          <value>book</value>
        </test>
      </condition>
    </vertex>
    <vertex name="movie">
      <condition>
        <test>
          <operator>eq</operator>
          <attribute-name>ReleaseType</attribute-name>
          <value>theater</value>
        </test>
      </condition>
    </vertex>
    <edge name="adapted-to">
      <vertex1>book</vertex1>
      <vertex2>movie</vertex2>
      <directed>true</directed>
      <condition>
        <test>
          <operator>eq</operator>
          <attribute-name>LinkType</attribute-name>
          <value>adapted-to</value>
        </test>
      </condition>
    </edge>
  </query-body>
  <editor-data>
    <vertex-location name="book" x="109.0" y="144.0" />
    <vertex-location name="movie" x="351.0" y="50.0" />
  </editor-data>
</graph-query>

