<?xml version="1.0" encoding="UTF-8"?>
<!DOCTYPE graph-query SYSTEM "graph-query.dtd">

<!-- Part of the open-source Proximity system (see LICENSE for 
     copyright and license information). -->

<graph-query name="SubQ_DB01_Q02">
  <description>Subquery box removed</description>
  <query-body>
    <vertex name="director">
      <condition>
        <test>
          <operator>eq</operator>
          <attribute-name>ObjType</attribute-name>
          <value>Director</value>
        </test>
      </condition>
    </vertex>
    <vertex name="movie">
      <condition>
        <test>
          <operator>eq</operator>
          <attribute-name>ObjType</attribute-name>
          <value>Movie</value>
        </test>
      </condition>
    </vertex>
    <vertex name="actor">
      <condition>
        <test>
          <operator>eq</operator>
          <attribute-name>ObjType</attribute-name>
          <value>Actor</value>
        </test>
      </condition>
      <numeric-annotation>
        <min>1</min>
      </numeric-annotation>
    </vertex>
    <edge name="directed">
      <vertex1>director</vertex1>
      <vertex2>movie</vertex2>
      <directed>true</directed>
      <numeric-annotation>
        <min>1</min>
      </numeric-annotation>
    </edge>
    <edge name="acted-in">
      <vertex1>actor</vertex1>
      <vertex2>movie</vertex2>
      <directed>true</directed>
      <numeric-annotation>
        <min>1</min>
      </numeric-annotation>
    </edge>
  </query-body>
  <editor-data>
    <vertex-location name="director" x="28.0" y="110.0" />
    <vertex-location name="movie" x="258.0" y="111.0" />
    <vertex-location name="actor" x="504.0" y="110.0" />
  </editor-data>
</graph-query>

