<?xml version="1.0" encoding="UTF-8"?>
<!DOCTYPE graph-query SYSTEM "graph-query.dtd">

<!-- Part of the open-source Proximity system (see LICENSE for 
     copyright and license information). -->

<graph-query name="Annot_DB05_Q01">
  <description>Books written by someone other than Stephen King</description>
  <query-body>
    <vertex name="author">
      <condition>
        <and>
          <test>
            <operator>eq</operator>
            <attribute-name>ObjType</attribute-name>
            <value>person</value>
          </test>
          <test>
            <operator>ne</operator>
            <attribute-name>Name</attribute-name>
            <value>Stephen King</value>
          </test>
        </and>
      </condition>
    </vertex>
    <vertex name="book">
      <condition>
        <test>
          <operator>eq</operator>
          <attribute-name>ObjType</attribute-name>
          <value>book</value>
        </test>
      </condition>
      <numeric-annotation>
        <min>1</min>
      </numeric-annotation>
    </vertex>
    <edge name="wrote">
      <vertex1>author</vertex1>
      <vertex2>book</vertex2>
      <directed>true</directed>
      <condition>
        <test>
          <operator>eq</operator>
          <attribute-name>LinkType</attribute-name>
          <value>author-of</value>
        </test>
      </condition>
      <numeric-annotation>
        <min>1</min>
      </numeric-annotation>
    </edge>
  </query-body>
  <editor-data>
    <vertex-location name="author" x="98.0" y="142.0" />
    <vertex-location name="book" x="413.0" y="271.0" />
  </editor-data>
</graph-query>

