<?xml version="1.0" encoding="UTF-8"?>
<!DOCTYPE graph-query SYSTEM "graph-query.dtd">

<!-- Part of the open-source Proximity system (see LICENSE for 
     copyright and license information). -->

<graph-query name="Basics_DB03_Q01">
  <description>Query using undirected link</description>
  <query-body>
    <vertex name="B" />
    <vertex name="A" />
    <edge name="X">
      <vertex1>A</vertex1>
      <vertex2>B</vertex2>
      <directed>false</directed>
    </edge>
  </query-body>
  <editor-data>
    <vertex-location name="B" x="392.0" y="106.0" />
    <vertex-location name="A" x="130.0" y="105.0" />
  </editor-data>
</graph-query>

