<?xml version="1.0" encoding="UTF-8"?>
<!DOCTYPE graph-query SYSTEM "graph-query.dtd">

<!-- Part of the open-source Proximity system (see LICENSE for 
     copyright and license information). -->

<graph-query name="Const_DB01_Q01">
  <description>One-dimensional cluster query</description>
  <query-body>
    <vertex name="core_page">
      <condition>
        <test>
          <operator>eq</operator>
          <attribute-name>ObjType</attribute-name>
          <value>web page</value>
        </test>
      </condition>
    </vertex>
    <vertex name="linked_page">
      <condition>
        <test>
          <operator>eq</operator>
          <attribute-name>ObjType</attribute-name>
          <value>web page</value>
        </test>
      </condition>
      <numeric-annotation>
        <min>1</min>
      </numeric-annotation>
    </vertex>
    <edge name="link">
      <vertex1>core_page</vertex1>
      <vertex2>linked_page</vertex2>
      <directed>true</directed>
      <numeric-annotation>
        <min>1</min>
      </numeric-annotation>
    </edge>
  </query-body>
  <editor-data>
    <vertex-location name="core_page" x="89.0" y="122.0" />
    <vertex-location name="linked_page" x="345.0" y="204.0" />
  </editor-data>
</graph-query>

