<!DOCTYPE graph-query SYSTEM "graph-query.dtd">

<graph-query name="New Query">
    <description>New Editor Query</description>
    <query-body>
        <vertex name="T">
            <condition>
                <test>
                    <operator>eq</operator>
                    <attribute-name>objecttype</attribute-name>
                    <value>T</value>
                </test>
            </condition>
        </vertex>
        <edge name="linksFrom">
            <vertex1>S</vertex1>
            <vertex2>T</vertex2>
            <directed>true</directed>
            <numeric-annotation>
                <min>1</min>
            </numeric-annotation>
        </edge>
        <subquery>
            <vertex name="S">
                <condition>
                    <test>
                        <operator>eq</operator>
                        <attribute-name>objecttype</attribute-name>
                        <value>S</value>
                    </test>
                </condition>
            </vertex>
            <vertex name="linkedT">
                <condition>
                    <test>
                        <operator>eq</operator>
                        <attribute-name>objecttype</attribute-name>
                        <value>T</value>
                    </test>
                </condition>
                <numeric-annotation>
                    <min>0</min>
                </numeric-annotation>
            </vertex>
            <edge name="linksTo">
                <vertex1>S</vertex1>
                <vertex2>linkedT</vertex2>
                <directed>true</directed>
                <numeric-annotation>
                    <min>1</min>
                </numeric-annotation>
            </edge>
            <numeric-annotation>
                <min>0</min>
            </numeric-annotation>
        </subquery>
    </query-body>
    <editor-data>
        <vertex-location name="T" x="52" y="150"/>
        <vertex-location name="S" x="338" y="200"/>
        <vertex-location name="linkedT" x="621" y="253"/>
    </editor-data>
</graph-query>