<?xml version="1.0" encoding="UTF-8"?>
<!DOCTYPE graph-query SYSTEM "graph-query.dtd">
<graph-query name="_A_B12_X11RD">
    <description>_A_B12_X11RD</description>
    <query-body>
        <vertex name="A">
            <condition>
                <test>
                    <operator>eq</operator>
                    <attribute-name>objectType</attribute-name>
                    <value>A</value>
                </test>
            </condition>
        </vertex>
        <vertex name="B">
            <condition>
                <test>
                    <operator>eq</operator>
                    <attribute-name>objectType</attribute-name>
                    <value>B</value>
                </test>
            </condition>
            <numeric-annotation>
                <min>1</min>
                <max>2</max>
            </numeric-annotation>
        </vertex>
        <edge name="X">
            <vertex1>B</vertex1>
            <vertex2>A</vertex2>
            <directed>true</directed>
            <condition>
                <test>
                    <operator>eq</operator>
                    <attribute-name>linkType</attribute-name>
                    <value>X</value>
                </test>
            </condition>
            <numeric-annotation>
                <min>1</min>
                <max>1</max>
            </numeric-annotation>
        </edge>
    </query-body>
</graph-query>

