<?xml version="1.0" encoding="UTF-8"?>
<!DOCTYPE graph-query SYSTEM "graph-query.dtd">

<!-- Part of the open-source Proximity system (see LICENSE for 
     copyright and license information). -->

<graph-query name="Basics_DB01_Q03">
  <description>Query using comparison operator</description>
  <query-body>
    <vertex name="A">
      <condition>
        <test>
          <operator>eq</operator>
          <attribute-name>ObjType</attribute-name>
          <value>person</value>
        </test>
      </condition>
    </vertex>
    <vertex name="B">
      <condition>
        <test>
          <operator>lt</operator>
          <attribute-name>PubDate</attribute-name>
          <value>1990</value>
        </test>
      </condition>
    </vertex>
    <edge name="X">
      <vertex1>A</vertex1>
      <vertex2>B</vertex2>
      <directed>true</directed>
      <condition>
        <test>
          <operator>eq</operator>
          <attribute-name>LinkType</attribute-name>
          <value>author-of</value>
        </test>
      </condition>
    </edge>
  </query-body>
  <editor-data>
    <vertex-location name="A" x="97.0" y="109.0" />
    <vertex-location name="B" x="365.0" y="109.0" />
  </editor-data>
</graph-query>

