<!DOCTYPE graph-query SYSTEM "graph-query.dtd"> 

<!--
$Id: test-query.xml 1723 2004-12-09 16:45:43Z cornell $

Part of the open-source Proximity system
  (see LICENSE for copyright and license information).

-->
<graph-query name="Test Query">
    <description>a test query with a valid constraint (starts with AND)</description>
    <query-body>
        <vertex name="vertex1">
        </vertex>
        <edge name="v1-to-v2">
            <vertex1>vertex1</vertex1>
            <vertex2>vertex2</vertex2>
            <directed>true</directed>
            <numeric-annotation>
                <min>1</min>
            </numeric-annotation>
        </edge>
        <vertex name="vertex2">
        </vertex>
        <constraint>
            <and>
                <test>
                    <operator>ne</operator>
                    <item>
                        <item-name>vertex1</item-name>
                        <id/>
                    </item>
                    <item>
                        <item-name>vertex2</item-name>
                        <id/>
                    </item>
                </test>
                <test>
                    <operator>ne</operator>
                    <item>
                        <item-name>vertex2</item-name>
                        <id/>
                    </item>
                    <item>
                        <item-name>vertex1</item-name>
                        <id/>
                    </item>
                </test>
            </and>
        </constraint>
    </query-body>
</graph-query>
